id,name,category,catchphrase,description,history,food,photo_url
101,台北101,ランドマーク・絶景,世界最速エレベーターで雲の上へ,"<ul><li><strong>所在地：</strong>台北市信義区信義路五段7号</li><li><strong>構造：</strong>地上101階・地下5階、高さ508m（アンテナ含むと509.2m）</li><li><strong>エレベーター：</strong>5階→89階へ37秒（毎分1,010m / 時速約60km ※当時世界最速）</li><li><strong>展望台：</strong>屋内89階（382m） / 屋外91階（約392m）</li></ul>","1999年7月31日着手、2004年12月31日に開業。<br>建設費は約1.9億米ドル（約285億円）。<br>かつて世界一の高さを誇った台湾のシンボルタワー。",高層階レストラン・地下フードコート,https://images.unsplash.com/photo-1542000551-75e3c7903fb6?auto=format&fit=crop&q=80&w=800
102,台北市郷土教育センター,文化・学習,遊びながら学ぶ台北の昔の生活,"教育と文化の理念を融合し、郷土教育を推進している施設。<br>教育活動が多く行われており、異なる種類の展覧会と合わせて遊びながら学べるスポットである。<br><strong>入場無料</strong>で、台北市の昔の生活様式を見ることができる。",かつての名医の邸宅や薬局の建物を修復・活用して設立された。剥皮寮歴史街区に隣接しており、一体となって地域の歴史を伝えている。,-,https://upload.wikimedia.org/wikipedia/commons/thumb/6/65/Heritage_and_Culture_Education_Center_of_Taipei.jpg/800px-Heritage_and_Culture_Education_Center_of_Taipei.jpg
103,剥皮寮歴史街区,歴史・聖地,映画『モンガに散る』の舞台,"現在の台北市萬華区（旧・艋舺/バンカ）にある歴史保存地区。<br>清朝時代からの通りがあり、日本統治期の建物が一部残っていたことから、2009年に整備された。<br>現在は萬華の歴史を伝えるとともに、文化活動や地域活動を行うスポットになっている。"",かつてこの一帯は「剝皮寮（ポーピリャオ）」と呼ばれていた。地名の由来は、ここで木材の皮を剥いでいたことから。<br>艋舺は清朝時代に台北で最初の貿易港として栄え、台北発祥の地とされている。<br>2010年の大ヒット映画『艋舺（MONGA）』の撮影地としても有名。",龍山寺周辺の屋台グルメ,https://images.unsplash.com/photo-1623940212815-5655761eb85e?auto=format&fit=crop&q=80&w=800
104,華山1914文創園区,アート・映え,レトロ建築 × 最新カルチャー,"日本統治時代の建物をリノベーションしたエリア。<br>ギャラリーやカフェ、ショップ、映画館などの様々な施設が立ち並ぶ。<br>当時のレトロな雰囲気と最新のカルチャーが融合したおしゃれな複合施設で、写真映えも抜群。<br>キャラクターやアニメの期間限定展示やポップアップショップも頻繁に開催されている。",元々は酒造工場だった場所をリノベーションして活用。<br>廃墟となっていた時期を経て、アートと文化の発信地として生まれ変わった。,お洒落カフェ・レストラン,https://images.unsplash.com/photo-1563293836-e0bd2631553e?auto=format&fit=crop&q=80&w=800
105,二二八平和公園,歴史・鎮魂,台北の歴史を刻む鎮魂の場所,"1899年に造園された「台北新公園」を前身とする西洋風の公園。<br>園内には博物館や記念碑があり、市民の憩いの場であると同時に、台湾の激動の歴史を今に伝える重要な場所である。",1947年2月28日に発生した「二二八事件」では、国民党政府に抗議する多数の市民が死傷した。<br>その後、台湾は1987年まで戒厳令が継続され、「白色テロ」と呼ばれる弾圧が行われた。<br>事件を追悼して1996年に現在の名称に改名された。,-,https://upload.wikimedia.org/wikipedia/commons/thumb/c/cf/228_Peace_Memorial_Monument_20190601.jpg/800px-228_Peace_Memorial_Monument_20190601.jpg
106,金峰ルーローハン,グルメ・必食,全部合わせても100元以内！,"地元民にも観光客にも大人気の行列店。<br><strong>看板メニュー：</strong>ルーローハン（大中小サイズ選択可）。<br>豚肉と椎茸を8種類の漢方で煮込んでいるのが特徴。<br>サイドメニューの豚肉スープや鴨の煮卵なども絶品で、全部合わせても100元（約500円）以内という驚きの安さ。",南門市場の近くにあり、長年愛され続けている老舗。台湾のソウルフード「魯肉飯」の代表格の一つ。,ルーローハン、肉焿湯（肉つみれスープ）,https://images.unsplash.com/photo-1627204487771-468819543ccf?auto=format&fit=crop&q=80&w=800

